"","screenName","location","latitude","longitude","state","tweetID","text"
"1","_ashleyterry_","Bellingham, WA",48.7519112,-122.4786854,"Washington",1100475632281104384,"Gua Sha : to clear puffiness under my eyes, smooth fine lines, and help keep my skin clear by stimulating the lymph… https://t.co/bSVgAtopFZ"
"2","_ashleythomas","lexington ky",38.0405837,-84.5037164,"Kentucky",1100555321225945088,"On a happier note- mono is actually progressing my weight loss goals because the lymph node in my neck is the size… https://t.co/nTjk0SarfU"
"3","_bhog_","Cleveland",41.49932,-81.6943605,"Ohio",1101189012772016128,"@Bri_Halei Damn that’s crazy my shit felt like that too!.. head,ears,&amp; my lymph nodes were swollen smh I feel your pain. <U+0001F62B>"
"4","_I_d_u_n_","a rivermouth near you",46.5554597,-85.034057,"Michigan",1101021686592352256,"does anyone have any experience on figuring out whether something is a swollem lymph node or an abscess"
"5","_lycheemonster","Olympia, WA",47.0378741,-122.9006951,"Washington",1101541888295751680,"Gotta get my lymph in order https://t.co/hOIxqViWHr"
"6","_MissMelody","Springfield, OREGON",44.0462362,-123.0220289,"Oregon",1102259914766839808,"Woke up severely congested, head and lungs, lymph nodes in neck huge... thought I was going to die..body aches.. et… https://t.co/zGOeNirMFf"
"7","_YOUNGBABY_","nyc",40.7127753,-74.0059728,"New York",1100913709092880384,"@nnHirsch @alsfoodjournal Absolutely yes apparently she rolls and drains ur lymph out first and then does the thing"
"8","21Drea__","209",39.04189,-94.58426,"Missouri",1102028919463534592,"@FknAngie No they aren’t red. Usually my lymph nodes get really swollen. If it gets worse i definitely will."
"9","420lanie","Texas, USA",31.9685988,-99.9018131,"Texas",1101133656515596288,"Michael House from the UK was told he had incurable prostate cancer that had metastasized to his pubic bone and his… https://t.co/5eclN9Esy1"
"10","7niner6","Pennsylvania, USA",41.2033216,-77.1945247,"Pennsylvania",1100422347574648832,"@LivWithMelanoma best of luck to you !! My husband has been beating melanoma for 8 years been in active immunothera… https://t.co/hJVmqtFM4g"
"11","7niner6","Pennsylvania, USA",41.2033216,-77.1945247,"Pennsylvania",1100424399050690560,"@MelanomaUnfilt1 glad to see others who fight the fight for melanoma !! My husband has been beating melanoma for 8… https://t.co/Zsmfzd1hAm"
"12","abbiepinski","Yukon, OK",35.5067215,-97.7625441,"Oklahoma",1101213114341752832,"my body literally hates me rn. i’ve gained 10 pounds in 2 months. i have swollen lymph nodes, one of my wisdom teet… https://t.co/8dJAbAJB7f"
"13","AestheticMDoc","New York, NY, United States",40.7127753,-74.0059728,"New York",1101864508232999936,"Cosmetic - Aesthetic &gt; Prophylactic Incisional Negative Pressure-- https://t.co/aYvxPKhJzf #plastic"
"14","Ageless_Herbs","North Carolina USA",35.7595731,-79.0192997,"North Carolina",1100485401532424192,"A gentle spring detoxification formula that stimulates the flow of lymph &amp; clears liver congestion:… https://t.co/NQVqmtLeXS"
"15","AGYG2014","Under Ground ",47.602375,-122.333654,"Washington",1101211812400455680,"@daveyesfan @DiscoverMag I always thought that our lymph nodes were gills as a child, when unwell, I'd complain about my gills being sore!"
"16","ahisom74"," Jackson, Tennessee",35.6145169,-88.8139469,"Tennessee",1101867500491427840,"@Iamjeanniejean @diamondslil @BentButterfly1 @LadegastTia @GillPill77 @DebbyCov @79Aspen @ThisisKirstenC… https://t.co/RMHfBZOcZ2"
"17","AleaJuneMortens","Downey, CA",33.9401088,-118.1331593,"California",1100655663724748800,"During my moms surgery they found 3 lymph nodes and they could only see 1 out of the 3 that had cancer so they had… https://t.co/wCIVddJ2Ra"
"18","Alexavilla__","Stephenville, TX",32.2206958,-98.2022633,"Texas",1100934427239174144,"Y’all my lymph node is swollen so I googled it and it said sudden swelling of it indicates cancer so goodbye"
"19","AllyHartman","St. Francis University '18",40.50382,-78.6376191,"Pennsylvania",1101149244516384768,"@Abi_Waksmunski My lymph nodes are so swollen you can see them from a mile away <U+0001F602> peds is killing me lmao"
"20","AnnaDsays","Austin, TX",30.267153,-97.7430608,"Texas",1100200822787506176,"My ears hurt and the lymph nodes in my neck are all swollen. Ugh."
"21","ASCO","Alexandria, VA",38.8048355,-77.0469214,"Virginia",1101202931318173696,"New ASCO Guideline on Head and Neck Cancer Clarifies Lymph Node Management: https://t.co/E80v2nMitO #ASCOdailynews #hncsm"
"22","AshieCorner","Ohio, USA",40.4172871,-82.907123,"Ohio",1101129535960039424,"Today is #RareDiseaseDay and I wanted to talk about Primary Lymphedema. This is a disease that starts at birth when… https://t.co/BQjsQ3frgK"
"23","ashley__willis","Halloween Town",34.170582,-118.339838,"California",1100936991926087680,"my head kills, my throat is sore, my lymph nodes are swollen + they hurt like a bitch :)))"
"24","AssociateMTs","Fort Wayne, IN",41.079273,-85.1393513,"Indiana",1100395107675705344,"Long-term benefits of regular massage:
•Improve blood &amp; lymph flow 
•Improve flexibility
•Relief pain
•Relief stres… https://t.co/3LS7TmXjcg"
"25","Awithonelison","New Jersey",40.0583238,-74.4056612,"New Jersey",1100450619733786624,"@Nopesorrydumbo @5hackie @Jordan_Sather_ @PatriotDreamerz There is also a lymph system in the brain that's separate… https://t.co/fHpmxWhyDO"
"26","ayekrissy","St Louis, MO",38.6270025,-90.1994042,"Missouri",1101332677276372992,"Whewwww I can finally get some sleep! My lymph node felt swollen but it’s been like that for months now"
"27","bagel_angel_","Flavortown, USA",33.206648,-82.389809,"Georgia",1101364589961400320,"say hello to my little friend (lymph node)"
"28","balancecancer","New York, NY",40.7127753,-74.0059728,"New York",1101648947351879680,"The rebirth one year after the surgery to remove my breastcancer my mastectomy and lymph node extraction and how I… https://t.co/0xZ9LNil2Q"
"29","bbycurves","Lazy Links",45.076836,-93.1360529,"Minnesota",1100515855325114368,"The fact that people can’t come to work for bullshit excuses but I can be there with ear infections and an inflamed lymph node <U+0001F602>"
"30","BChilt","Los Angeles, CA",34.0522342,-118.2436849,"California",1100936080906317824,"@NielsKnk Could just be that cheeseburger w onions from yesterday floating through her lymph."
"31","BeccaPrevisMD","Durham, NC",35.9940329,-78.898619,"North Carolina",1101246073430048768,"No benefit in PFS or OS (but higher complications) for advanced #OvarianCancer patients who received pelvic and PA… https://t.co/Atb4mb2XaQ"
"32","beckadelic","Palm Bay, FL",28.0344621,-80.5886646,"Florida",1101739765299331072,"@D1Antc “Lymph nodes” lol... like who came up with this term. <U+0001F9D0> anyway, maybe try some Chloraseptic throat spray! I… https://t.co/JlkOkb896i"
"33","BiggestComeback","New York",40.7127753,-74.0059728,"New York",1101534159162535936,"@TrumbullSteve Red, white, lymph, neutrophil, you name it..."
"34","Billcaswell8","Louisville, KY",38.2526647,-85.7584557,"Kentucky",1100621729460830208,"It’s a 11:55 pm I’m tired <U+0001F634> can’t sleep cause I have a lot on my mind root canal at 8am then Thursday having anothe… https://t.co/x9z9SzZvN0"
"35","bimbomouse","Virginia, USA",37.4315734,-78.6568942,"Virginia",1101357929553379328,"if i have a stomach ache, headache, swollen lymph nodes and I’m losing weight, would you consider me sick?"
"36","BitchWithA_W","Boston, MA",42.3600825,-71.0588801,"Massachusetts",1100508576076967936,"my tonsil and lymph node has been swollen on the right side for a little over a week and I have rly rly bad inner e… https://t.co/p5XOAEivvy"
"37","blamom","PA",41.2033216,-77.1945247,"Pennsylvania",1100859724059295744,"Scientists study tattooed corpses, find pigment in lymph nodes https://t.co/fomg0XG7DQ"
"38","bobbslobber","usa new york",40.7127753,-74.0059728,"New York",1101265932603834368,"@iammickloven Usually that is a freak out and lymph nodes are there that fight infection, but let them look down in… https://t.co/qAJLesMusy"
"39","brain_bpd","Michigan, USA",44.3148443,-85.6023643,"Michigan",1102184337670397952,"Woke up with swollen lymph nodes and stuffy nose <U+0001F629> I can’t handle being more unwell right now <U+0001F62D>"
"40","BusDadInc","Vermont",44.5588028,-72.5778415,"Vermont",1100231352904019968,"@Laser_Cat Yep, and some lymph nodes"
"41","canis_brillante","ATX",30.2649158,-97.7493159,"Texas",1100810180986572800,"me, at my lymph nodes as they are slightly larger than they were yesterday: https://t.co/tdmK8t0DrX"
"42","CassieJLind","Las Vegas, NV",36.1699412,-115.1398296,"Nevada",1102259648134995968,"@askjillian Exactly what I had.  It got to 10/17 lymph nodes."
"43","CharleeHoffman","Missoula, MT",46.8721284,-113.9940314,"Montana",1100110085785702400,"I am extremely ill and in a lot of pain. I got sick my last week in Italy, and what started out as a simple head co… https://t.co/rkUIZDPl70"
"44","chhardman","Utah",39.3209801,-111.0937311,"Utah",1100392982379786240,"The rebounder increases lymph circulation throughout the body but up to 10x it's normal rate."
"45","ChrisVanD4","California, USA",36.778261,-119.4179324,"California",1101296703569682432,"So had a visit will my buddy i went to the academy with he has Stage IV cancer in a lymph node by his arm. He is ta… https://t.co/mEjbxtviDN"
"46","chupacabrito","Dallas, TX",32.7766642,-96.7969879,"Texas",1101232410400907264,"Voir dire just finished. DUI case. Waiting to see if I’m one of the 6 out of 24 people. I think the defense liked m… https://t.co/LPXSBGg3I3"
"47","CMC_Lancaster","Lancaster, Texas",32.5920798,-96.7561082,"Texas",1100455970097061888,"Improve your circulation &amp; help your lymph glands to drain by the way you towel off. Helping your lymph glands func… https://t.co/lR5Ume5u7h"
"48","connied319","Slidell, LA",30.2751945,-89.7811745,"Louisiana",1100789685201326080,"@TGDsquad My Grandson has what they originally described as a bacterial infection in his lymph nodes that has retur… https://t.co/AVFj7GVkwb"
"49","copperheaad","Inglewood, CA",33.9616801,-118.3531311,"California",1100164659414368256,"It’s cold season y’all, raw crushed garlic and honey will fix that. As well as warm lime slices on your lymph nodes… https://t.co/Jzym3RQyIY"
"50","crosearch1","Charleston, SC",32.7764749,-79.9310512,"South Carolina",1101597071662972928,"After his fourth treatment on Wednesday Indigo was in complete remission lymph nodes back to normal.  We will have… https://t.co/zpPc5xxdHr"
"51","CrossoBethers","Florida, USA",27.6648274,-81.5157535,"Florida",1100453639116730368,"My sister who does radiation therapy just started asking me questions about a swollen lymph node that I’ve have for 4 years <U+0001F633>"
"52","CryptoGlamDoll","Atlanta ",33.7489954,-84.3879824,"Georgia",1101900399760629760,"@awwhalenawl You gotta detox your armpits . The advice is to use betonite clay or that Aztec clay. I’d do it once a… https://t.co/OF72rkbAL9"
"53","Ctaggart21","Utah, USA",39.3209801,-111.0937311,"Utah",1100971465032122368,"Mixing the alcohol with my pulls is starting to take effect.  Hands are red as shit everything else is normal besid… https://t.co/HpzhEFfDEj"
"54","DaleYuzuki","Maryland USA",39.0457549,-76.6412712,"Maryland",1101294838388047872,"Manojlovic #AGBT19 Low volume=lymph node mets, lower mortality. Hi volume=escape to bone or visceral mets. Aggressi… https://t.co/rjXCnANGET"
"55","debbiegoins74","Phenix City, AL",32.4709761,-85.0007653,"Alabama",1100543273649754112,"Update: As expected, the doctor recommends that I have my lymph nodes checked. So, I will have one more surgery on… https://t.co/4JEVUTP7C2"
"56","debbiegoins74","Phenix City, AL",32.4709761,-85.0007653,"Alabama",1100575420192358400,"@Jamie17452 Yes!! As long as my lymph nodes are clear. Which I have faith they WILL BE <U+0001F64F><U+0001F3FB>"
"57","debryan96962349","Watertown, NY",43.9747838,-75.9107565,"New York",1101648030359580672,"No alcohol!  I do not drink!  I do have lymph massages with my PT and do sauna's, as well as meditation!  Thank you… https://t.co/TKZIhnWph3"
"58","deedee_regan","Michigan, USA",44.3148443,-85.6023643,"Michigan",1101124173143908352,"The diagnosis is Stage 2 Invasive Ductal Carcinoma with it also being in her lymph nodes, the treatment plan is to… https://t.co/VgpXFjEy2R"
"59","deepinsights19","Dunya",38.8138332,-77.1352756,"Virginia",1100385394498174976,"@Dietpopsicle @Theway76709861 @KitemanArgues @JustBasharico @Unlockthedoor77 @054durin @rasaputins @Colossis2… https://t.co/0eku5YO397"
"60","devorahjsklar","Orcutt, CA",34.8652574,-120.4359966,"California",1102290558779678720,"Scientists study tattooed corpses, find pigment in lymph nodes https://t.co/mtpbDR3PwW"
"61","DFXCustoms","Bradenton, FL",27.4989278,-82.5748194,"Florida",1101785446684737536,"Crazy to think 3 years ago to this day I got misdiagnosed with a form of cancer that could have been leukemia or ly… https://t.co/2K1RJQffA1"
"62","DiagnosticCyto","Malden, MA",42.4250964,-71.066163,"Massachusetts",1100410569985744896,"Diagnostic utility of immunohistochemical analysis and Epstein–Barr virus-encoded small RNAs in situ hybridisation… https://t.co/991XWT98mr"
"63","diamondsamosa","TRUE NORTH",32.7477155,-117.1299354,"California",1101564910272684032,"where the hell are the lymph nodes"
"64","Ding_Gorgeous","Rochester, MN",44.0121221,-92.4801989,"Minnesota",1101569141432086528,"Week three chemotherapy is complete! Our vet said Ellie is doing great! Her lymph nodes and lip mass continue to sh… https://t.co/iz0a8ZWoPw"
"65","DLauro","Hell",42.43472,-83.985,"Michigan",1101760353183000064,"Silence of the Lymph Nodes  #BodyPartFilms"
"66","dollfvceshay","Columbus, OH",39.9611755,-82.9987942,"Ohio",1102015599901921280,"I got rid of fever on my own and now my headaches are less and lymph nodes going back down .. if it wasn’t getting… https://t.co/HRXMHHYeEa"
"67","dorobothy_p","The Freshest of Hells",40.7608862,-73.9890184,"New York",1101003085030326272,"The first thing I do in the morning is brush my lymph node and sharpen my mouth."
"68","dorobothy_p","The Freshest of Hells",40.7608862,-73.9890184,"New York",1100957799725572096,"The first thing I do in the morning is brush my lymph node and sharpen my collar bone."
"69","dovahmhysa","Los Angeles, CA",34.0522342,-118.2436849,"California",1100876427166068736,"Absolutely LOVE how my body just keeps inventing new problems. Strep throat? Boring. The flu? Meh.

All the lymph n… https://t.co/5adzWW8czG"
"70","DrewMoghanaki","Atlanta, GA",33.7489954,-84.3879824,"Georgia",1101657212366270464,"@waleed246 @BrendonStilesMD Last time I checked, the evidence shows that DM risk after surgery or SBRT for clinical… https://t.co/AAzZrTEtR1"
"71","drgarynull","NYC",40.7127753,-74.0059728,"New York",1100880938274357248,"Scientists study tattooed corpses, find pigment in lymph nodes https://t.co/QrVnU9BRr4"
"72","DrHeelan","West Palm Beach, FL.",26.7153424,-80.0533746,"Florida",1100368111549726720,"Scientists study tattooed corpses, find pigment in lymph nodes https://t.co/ojMNz3ktBg"
"73","DrPhilippaJhean","South Side, Chicago",41.8054641,-87.6087638,"Illinois",1102253808090939392,"Support your body's natural cleansing pathways with these daily practices https://t.co/pXwx1vnbbm #body @mindbodygreen @thewholecure"
"74","Dubhly13","Illinois, USA",40.6331249,-89.3985283,"Illinois",1100122611139469312,"@EmilyHopeAllyn Yes it is, so comment still stands Em ;) cute doggie.
I just found a lump near the back of the jaw… https://t.co/vepv2ZMJhc"
"75","ECAware","worldwide",36.249758,-95.266826,"Oklahoma",1100817863798124544,"#ECAA
#ECAware https://t.co/W7082zAFKi"
"76","ekhanafshar","San Francisco, CA",37.7749295,-122.4194155,"California",1101240723926540288,"#FNA of a cervical lymph node in a HIV+ patient #CytoPath #cytology https://t.co/PDj99gHu5k"
"77","elisabobisa917","San Leandro, CA",37.7249296,-122.1560768,"California",1100808279997833216,"@SenKamalaHarris I’m guessing none of the people commenting on this thread have ever been close to carrying a no vi… https://t.co/tLxBxcX0jV"
"78","ElizabethGalen","Austin, Texas",30.267153,-97.7430608,"Texas",1100903676225470464,"@CteenDryer Phytolacca decandra is a homeopathic that might help. Ear candling helps a lot but isn't recommended by… https://t.co/oIRlDDhL9j"
"79","EmbryoResist","New Jersey, USA ",40.0583238,-74.4056612,"New Jersey",1101617917546905600,"@RogueEPAstaff Note the increased *apoptosis* there -- that's programmed cell death.
Cleared by the immune system /… https://t.co/TPsXxcURhD"
"80","eoElevate","Utah and Texas ",39.3209801,-111.0937311,"Utah",1101968382922903552,"Scott Hathaway is going to be sharing his lymph knowledge next week! If you are local to the Boise /Nampa area.....… https://t.co/LErdX9P3Fs"
"81","ErYeezy","713",29.74255,-95.399022,"Texas",1101971047522414592,"I’m all done with my work!!! Glory!! But this lymph node is swollen and irritating me"
"82","exervolve","Sparta, NJ",41.0334562,-74.6363588,"New Jersey",1100760763847839744,"So we learned some new stuff recently. If you were wondering why we closed for 3 days click the link below… https://t.co/w7GjLlQR6M"
"83","FandIncollingo","Central NJ",40.0583238,-74.4056612,"New Jersey",1101183608411377664,"In the spring issue of CURE, we will explore whether lymph node transplants could be the answer to resolving lymphedema. #cureconnect"
"84","Farida_126","out of the box",42.8120578,-86.0158654,"Michigan",1101550334307168256,"@zeinaamohamedd Graph mafish, dna, antibody, lymph node"
"85","finesse_god_","Chicago",41.8781136,-87.6297982,"Illinois",1100652667439861760,"Real life hate being sick especially to the point my lymph nodes swell up"
"86","fnyland45","Massachussetts,US",42.4072107,-71.3824374,"Massachusetts",1101889669464240128,"Every Sunday Yoga class at 9am, come and participate!
Some benefits:
It improves posture, prevents joint pain, prot… https://t.co/6sVohUh9os"
"87","gastroendonews","New York, New York",36.1023715,-115.1745559,"Nevada",1101995922353844224,"Dr. Klapman: fiducials mostly studied in pancreas, but also performed in stomach, esophagus, lymph nodes and other… https://t.co/1W6xLnHymV"
"88","GaunderSaige","Kalamazoo, MI",42.2917069,-85.5872286,"Michigan",1100370232101818368,"Remember how I said swollen lymph nodes weren’t a joke well bronchitis in February shouldn’t be a thing <U+0001F610>"
"89","gdinspired1","World Wide",36.249758,-95.266826,"Oklahoma",1100301839210295296,"6 Steps to Decongest the Lymph | John Douillard's LifeSpa https://t.co/omZv73q45X"
"90","geoffreyburns","Ann Arbor, MI",42.2808256,-83.7430378,"Michigan",1102030825019920384,"If I had to guess, I’d say he’s cupping his lymph nodes (neck and groin) https://t.co/uQY3Qwo5U5"
"91","GEResearch","Across the globe",30.2612181,-81.5876595,"Florida",1100939646505242624,"<U+0001F52C>We're researching the use of quantitative-ultrasound (QUS) methods to detect metastases in lymph nodes in a broad… https://t.co/eWxTkmbqqH"
"92","GFandGlittery","Los Angeles, CA",34.0522342,-118.2436849,"California",1102036655123263488,"@medicalaxioms I’m also in medicine and he took a photo of lymph node because I wanted to see it <U+0001F602> he was awesome.… https://t.co/77na3TLIep"
"93","GFandGlittery","Los Angeles, CA",34.0522342,-118.2436849,"California",1102036513380950016,"@medicalaxioms Age 22, needed occipital lymph node remove to r/o lymphoma. Surgeon came in &amp; asked to see hairline… https://t.co/y3uqszQvtd"
"94","graceakichan","New York, USA",40.7127753,-74.0059728,"New York",1101227783643168768,"*massages inflamed lymph nodes* 
Ah yes indeed it seems as though I AM sick"
"95","greydnls","Brooklyn, NY",40.6781784,-73.9441579,"New York",1100503188271218688,"Me: I wanna get swol this year. 
My lymph nodes: https://t.co/vwh1Wf1J8m"
"96","grinchmotron","Whoville",43.0135456,-89.4698158,"Wisconsin",1102134280279474176,"Your lymph node's a helpful chasm, your ovary's full of porcupines"
"97","grinchmotron","Whoville",43.0135456,-89.4698158,"Wisconsin",1102330574033862656,"Your lymph node's an empty hole"
"98","grinchmotron","Whoville",43.0135456,-89.4698158,"Wisconsin",1102239979869220864,"Your lymph node's an empty subscription"
"99","hamsacenter","Chicago, IL",41.8781136,-87.6297982,"Illinois",1100883699267194880,"When digestion is weak, lymph is stagnant, and toxins have circulated and deposited in the deeper tissues of the bo… https://t.co/LOu47z8MzV"
"100","HeartsatPlay","Ventura, California, USA",34.2804923,-119.2945199,"California",1101526117653991424,"Children naturally move to learn. Movement stimulates lymph, builds bone, oxygenates the brain, and facilitates sen… https://t.co/nUt2UvifeJ"
"101","HeartsatPlay","Ventura, California, USA",34.2804923,-119.2945199,"California",1101899830027182080,"Children naturally move to learn. Movement stimulates lymph, builds bone, oxygenates the brain, and facilitates sen… https://t.co/7CDhC4rOUw"
"102","HeartsatPlay","Ventura, California, USA",34.2804923,-119.2945199,"California",1100467377303474176,"Children naturally move to learn. Movement stimulates lymph, builds bone, oxygenates the brain, and facilitates sen… https://t.co/lj8uyf2Glj"
"103","HeartsatPlay","Ventura, California, USA",34.2804923,-119.2945199,"California",1102317892169719808,"Children naturally move to learn. Movement stimulates lymph, builds bone, oxygenates the brain, and facilitates sen… https://t.co/VLZriqTgCs"
"104","HeartsatPlay","Ventura, California, USA",34.2804923,-119.2945199,"California",1101158202580787200,"Children naturally move to learn. Movement stimulates lymph, builds bone, oxygenates the brain, and facilitates sen… https://t.co/uxhRFDNqYE"
"105","HeartsatPlay","Ventura, California, USA",34.2804923,-119.2945199,"California",1100843908412534784,"Children naturally move to learn. Movement stimulates lymph, builds bone, oxygenates the brain, and facilitates sen… https://t.co/qIk0fC1Xrm"
"106","hoenestIyy","NYC",40.7127753,-74.0059728,"New York",1100250170330091520,"Am I finna die because my lymph nodes swollen asf and I feel like I’m about to throw up <U+0001F633>"
"107","iamelexus","Santa Clara, CA",37.3541079,-121.9552356,"California",1100149624461918208,"my lymph nodes are literally on sicko mode"
"108","icantfindmybees","Lafayette, LA",30.2240897,-92.0198427,"Louisiana",1100863447733022720,"God I hate my lizard brain, I was at the doctor and she was feeling my lymph nodes and was like “huh you have unusu… https://t.co/C4CGT5iyez"
"109","IceSheetMike","Cheyenne land, Boulder, CO",39.9902347,-105.2351338,"Colorado",1102236252277858304,"So thankfully, my son is fine. It wasn’t appendicitis, it was swollen lymph nodes in his abdomen causing the pain a… https://t.co/2IAtHLqIcs"
"110","IconicLucky","Hell, NM",34.9039412,-106.4336333,"New Mexico",1100210384739422208,"@seansthirdeye Inner thigh swelling can be lymph nodes. Your immune system could be crying out for help... According to my doctor."
"111","IJSurgery","Global",37.0329949,-95.6400855,"Kansas",1100362223300403200,"The role of thymus preservation in parathyroid gland function and surgical completeness after bilateral central lym… https://t.co/tc8T9qDrw7"
"112","ImplantedTI","Burbank, CA",34.1808392,-118.3089661,"California",1101106235422601216,"Feb28/5am (509) Getting gassed with a chemical that always makes my lymph nodes swollen. #CBRNE… https://t.co/lL3YcMKmRh"
"113","Iowa4HTiffany","Des Moines, IA",41.5868353,-93.6249593,"Iowa",1100969234023239680,"@itsnot_pink I'm very sorry for your loss &amp; am lifting up prayers for her family. <U+0001F64F> I have a friend who is 37 w 3 s… https://t.co/JwHMlEVjAi"
"114","J26856126","Quantum",37.724043,-97.415992,"Kansas",1102289563643531264,"https://t.co/KWZdSI5ldh

This exact vax tore off literally my skin off. Extremely painful experience. Couldn’t put… https://t.co/oBtqGmWU1F"
"115","JAMADerm","Chicago, IL",41.8781136,-87.6297982,"Illinois",1101957854062395392,"Visit @JAMA_current booth 2305 at #AAD2019 to get a copy of the just published @JAMADerm paper ""Lymph node ratio is… https://t.co/sLXICujQW5"
"116","JAMASurgery","Chicago, IL",41.8781136,-87.6297982,"Illinois",1101980505791184896,"Having 4 or more positive #lymphnodes is associated with earlier disease recurrence, and a minimum of 8 lymph nodes… https://t.co/9KqFHmBcDX"
"117","jediyuhdigg","Los Angeles, CA",34.0522342,-118.2436849,"California",1100790329274298368,"Haven’t done an update in a while. Still alive. Just been busy with appts. And dealing with symptoms. Been having t… https://t.co/NAccCGovif"
"118","JeffreyKanneMD","Madison WI",43.0730517,-89.4012302,"Wisconsin",1101122925531410432,"FDG-PET/CT does not perform as well in staging mediastinal lymph nodes for non-small cell lung carcinoma in patient… https://t.co/zELNWhZ0re"
"119","Jenjay12","New Jersey",40.0583238,-74.4056612,"New Jersey",1100198078450229248,"7 Ways To Unclog Lymph Nodes To Reduce Swelling, Flush Out Toxins And Boost Immune System https://t.co/566rgWIImq"
"120","Joeybrown12345","Butte, MT",46.0038232,-112.5347775,"Montana",1102098326923759616,"n @pepsi i've drank nothing but diet pepsi for 8 and a half years and all my lymph nodes are swollen and i've been… https://t.co/GPL1D78b3B"
"121","John_Larson16","Frankfort, IL",41.4958665,-87.8486613,"Illinois",1100534102401396736,"my lymph nodes swell for a week and then just go away. it is remarkable."
