"","screenName","location","latitude","longitude","state","tweetID","text"
"242","sholyhitmanbat","Chicago area but travel extensively",41.8823113,-87.6320215,"Illinois",1101824879169585152,"@ShyCountryCutie Go to Urgent Care?  The lymph nodes issue doesn't sound allergy related.  Mumps?  Measles?  Shingles?"
"243","sidekick_matt","Hero City",37.5640473,-122.3253119,"California",1101666497837953024,"Ep 1: The Phantom Tennis (Elbow), Ep 2: The Bone Wars, Ep 3: Revenge of the Lymph (Nodes) #BodyPartFilms Star Wars Edition"
"244","SkinCancerOrg","New York, NY",40.7127753,-74.0059728,"New York",1101497642570403840,"While basal cell carcinomas rarely spread to the lymph nodes or beyond, they can grow large enough to cause disfigu… https://t.co/zBlYJwWA3c"
"245","slmcadam","Massachusetts, USA",42.4072107,-71.3824374,"Massachusetts",1100543261222027264,"@SelmaBlair @GMA @RobinRoberts I think you’re very brave to come out with your story I don’t know if anyone’s talk… https://t.co/DpMG2P4UCd"
"246","SlSSIES","18 | she/her",38.9981104,-94.7756407,"Kansas",1101282066761695232,"@jkt48twt the word comes from the latin word bubo which means a pustule, growth, or swelling. and the plague made (… https://t.co/7KEMRyBBdT"
"247","slvpknvt","Maryland, USA",39.0457549,-76.6412712,"Maryland",1101605432286695424,"I went to the doctor for a sore throat, come to find out it was a fever caused by a lymph node infection. So being… https://t.co/Hr5mu0gC5X"
"248","Smiles4me","Iowa",41.8780025,-93.097702,"Iowa",1101957958370496512,"Hi all!! So excited to have some strength to get out for fresh air and movement for my lymph system. https://t.co/Y619tC7mKd"
"249","sn00zecrew","nah",41.3477592,-74.8830066,"Pennsylvania",1100285898858520576,"she was diagnosed with colon cancer that has moved to her lymph nodes. she had the tumor in her colon removed earli… https://t.co/HrU5sCh4bv"
"250","snipeyhead","NYC expat in San Diego, CA",40.7127753,-74.0059728,"New York",1100842389902520320,"@OneManStands It’s not intrusive. I’ve been pretty open about all this, in the hopes it helps someone else. She’s g… https://t.co/VtmZsC77sO"
"251","spatch","Somerville, MA",42.3875968,-71.0994968,"Massachusetts",1100558782520795136,"got lymph nodes
in different area codes
(area codes)"
"252","stephaniemirro","Virginia, USA",37.4315734,-78.6568942,"Virginia",1100604144304443392,"#writingcommunity Tell me something weird/unique about yourself! Me? I'm allergic to hair dye. The one and only tim… https://t.co/GTRCPF1dt0"
"253","STEVENKOLKERMD","Santa Monica, CA",34.0194543,-118.4911912,"California",1101366809205268480,"Can you have more than one type of BRAF mutation in a melanoma, within the same lymph node or primary location?"
"254","stevesavitz","brooklyn",40.6781784,-73.9441579,"New York",1101537921830715392,"saw this coming years ago and decided never to get a tattoo. https://t.co/nRnIWMKuEx"
"255","streamlinebklyn","Brooklyn, NY",40.6781784,-73.9441579,"New York",1101246940807720960,"cpenenberg.pilates is rocking an inversion on the Reformer. Did you know inversions can improve circulation, postur… https://t.co/HRNB6JJt0M"
"256","SturgisSports","Greenville, SC",34.8526176,-82.3940104,"South Carolina",1101330243573432320,"OK, here’s the deal, too many have hit me up.  Foothills ENT and an Ultrasound on Tuesday confirmed a cluster of 7… https://t.co/AucUxXr1Mv"
"257","Sublime12NO","Onmyhorse",36.1414475,-79.8861627,"North Carolina",1101822602966913024,"@NicoM94020407 @hrtablaze @AnnaBD20 I believe 'this' cancer has reached  the 'lymph nodes. '"
"258","sunpungi","Philadelphia, PA",39.9525839,-75.1652215,"Pennsylvania",1101458479192162304,"#ISDP2019 Drs Doina Ivan and Fernandez-Figueras explaining hidradenoma can be present intravascular or in the lymph… https://t.co/ZcXfA0tqNH"
"259","SusanAllen11sd","Oregon, USA",43.8041334,-120.5542012,"Oregon",1100608773217968128,"@drunkhaught Swollen lymph nodes?"
"260","swiftnaturals10","North Carolina",35.7595731,-79.0192997,"North Carolina",1100224265595613184,"Scientists study tattooed corpses, find pigment in lymph nodes https://t.co/tAHVleXCBr"
"261","swuswuswu","Houston, TX",29.7604267,-95.3698028,"Texas",1101508263017885696,"Pulmonologist Dr. Lisa Kopas on EBUS:
-low complication rate
-superior to PET or CT for lymph node staging (PET sho… https://t.co/cTz5USNZLU"
"262","TakeThatCDC","Atlanta, GA",33.7489954,-84.3879824,"Georgia",1101295280799010816,"@itsmepanda1 @drfixus @MeddlinMegs @Gardeniagal4 @SIMON_E77 @AquaVelvaBoy @WendyOrent @GeoffSchuler @ghoppe… https://t.co/0onvnLSiXL"
"263","Tavstwitt","Kennewick, Washington USA",46.2086683,-119.119948,"Washington",1100951266073694208,"30 minutes in the Infrared Sauna,10 minutes on T-rex machine (shakes the lymph), and 5 minutes of Some Vitamin D in… https://t.co/5KO76NZvEI"
"264","Thaimassage919","5124 Bur Oak Cir Raleigh, NC",35.8533249,-78.7023418,"North Carolina",1101259252973359104,"Thai massage can increase your flow of lymph and strengthen your immune system"
"265","TheLymphieLife","Baltimore, MD",39.2903848,-76.6121893,"Maryland",1101480993549180928,"February is over, but the #research is still going! Check out the headlines from this past month in the latest Rese… https://t.co/GzfLryA8fH"
"266","thenext_step123","New York, NY",40.7127753,-74.0059728,"New York",1100199208412430336,"The rebirth one year after the surgery to remove my breastcancer my mastectomy and lymph node extraction and how I… https://t.co/GJdX16qLwV"
"267","thenext_step123","New York, NY",40.7127753,-74.0059728,"New York",1100924000161751040,"The rebirth one year after the surgery to remove my breastcancer my mastectomy and lymph node extraction and how I… https://t.co/hGpISQ1q66"
"268","theresasaylor73","Alabama ",32.3182314,-86.902298,"Alabama",1101575587062272000,"Three Day Lymph Cleanse Recipe - Health and Wellness - Mother Earth Living https://t.co/8BBl34CdsM"
"269","ThomGambino","New York City",40.7127753,-74.0059728,"New York",1102227671180865536,"@Lymph_Labo Hi, Lymph Labo. Bravo for the  <U+2764><U+FE0F>! Your steady support is a wonder to behold! We have many goodies for… https://t.co/n0NSPw9eBv"
"270","ThomGambino","New York City",40.7127753,-74.0059728,"New York",1100417785652486144,"@Lymph_Labo Thanks for the 3 <U+2764><U+FE0F>s, Lymph, Labo! And thanks for your support all these few weeks. I am extremely grat… https://t.co/pERFtMb1Yh"
"271","ThomGambino","New York City",40.7127753,-74.0059728,"New York",1101852209447428096,"@Lymph_Labo Hi, Lymph Labo. Bravissimo for the support &amp; <U+2764><U+FE0F>! A few of our favorite musical projects that nearly scr… https://t.co/QZN5sHlpfa"
"272","ThomGambino","New York City",40.7127753,-74.0059728,"New York",1101491033844658176,"@Lymph_Labo Thanks for your support &amp;  <U+2764><U+FE0F>, Lymph Labo. My recent appearance on Ally's Attic Show (she in Winnipeg,… https://t.co/Ki5oqiRaPJ"
"273","TLCschool","Austin, Texas",30.267153,-97.7430608,"Texas",1100863497800433664,"Only five spots left. Register now! https://t.co/ebxWNYSpwd
#massage #massageworkshop #massageschool #austin #lymph… https://t.co/xIfHcsg4jP"
"274","TLCschool","Austin, Texas",30.267153,-97.7430608,"Texas",1101214231024881664,"Only five spots left. Register now! https://t.co/ebxWNYSpwd
#massage #massageworkshop #massageschool #austin #lymph #mld"
"275","tomfolanmd","The Internets",39.4714884,-119.7767248,"Nevada",1102327964853710848,"2/

Timeline/History: 

Oct 16 - Pt. diagnosed with Left Lower Lobe (LLL) 2.5 x 2.5cm mass (Black arrows) &amp; mediast… https://t.co/0zqHugHK4M"
"276","tomfolanmd","The Internets",39.4714884,-119.7767248,"Nevada",1102330989374627840,"4/

Jan 18: Repeat CT reveals stable appearances of the small residual opacity in the left lower lobe and mediastinal lymph nodes."
"277","tomfolanmd","The Internets",39.4714884,-119.7767248,"Nevada",1102339941592293376,"3/

Dec 16 CT: Mass enlarged, now 2.7 x 2.8cm. Stable adenopathy. 
July 17:  chest xray shows progressive changes i… https://t.co/rNJBityqwI"
"278","transwolverine","Florida",27.6648274,-81.5157535,"Florida",1100609321052921856,"the lymph nodes in my throat? the ones they usually CHECK at the doctor's? fine. no problems at all. my armpit? hurts so fucking much"
"279","transwolverine","Florida",27.6648274,-81.5157535,"Florida",1100608425166295040,"my lymph node in my armpit is so swollen you can like, see it, and like... can I die, actually? can I just die,"
"280","TXHarrington","Houston, TX",29.7604267,-95.3698028,"Texas",1102308767172042752,"@K9TRex Glad to see he’s doing well Paul!! Our dog also just had surgery at A&amp;M (toe amputated &amp; lymph node removed… https://t.co/hHAV753fi8"
"281","UFGeog","Gainesville, FL",29.6516344,-82.3248262,"Florida",1101215112688558080,"Glanders also causes swelling of lymph system."
"282","urdadssidepiece","New York, NY",40.7127753,-74.0059728,"New York",1100599497216925696,"Q: What are the symptoms of becoming positive? Girl, I'm a total hypochondriac. 

A: Sxs usually present as flu-lik… https://t.co/c5uAi3b1b2"
"283","veevvie","Atlanta, GA",33.7489954,-84.3879824,"Georgia",1100831854645727232,"@Kimimel13 Thank you! I ended up barely eating chicken noodle soup, so I’ll wait for the rancy stuff later. Reheati… https://t.co/Pwc7etBiUp"
"284","veevvie","Atlanta, GA",33.7489954,-84.3879824,"Georgia",1100479586687692800,"@Kimimel13 Thanks. <U+0001F495> Something is going on with my lymph nodes (prob first sinus infection in months <U+0001F64C>) but I think… https://t.co/gNRMTVhzJW"
"285","vingular","Magic shop ",36.2002002,-95.1667331,"Oklahoma",1102250496813879296,"The reason why I almost fainted is because i have Inflammation of lymph nodes!!!!!"
"286","vpkmapi","Fairfield, IA",41.0076114,-91.9636914,"Iowa",1101618239329710080,"Guggul (pronounced just like Google) is a powerful Ayurvedic botanical that boosts the liver's ability to detox, wh… https://t.co/xJ8a6R49Uj"
"287","wendyfreemann","Reno, NV",39.5296329,-119.8138027,"Nevada",1100434330059386880,"When my lymph nodes are swollen I ice them, and I feel like no one else does but me..."
"288","WendyNofer","Pennsylvania, USA",41.2033216,-77.1945247,"Pennsylvania",1100526967210811392,"@AlaskaAir @reply Victoria, BC. Studied manual lymph drainage the entire week till 4AM every night to pass the course. I hear it's beautiful"
"289","westsidewell","Providence, RI",41.8239891,-71.4128343,"Rhode Island",1100464719939420160,"Jenny Xie does everything from reiki and manual lymph drainage to deep tissue. Aria started trained in reiki and tr… https://t.co/RcPqnzP8VF"
"290","Wh0v1an_4_L1fe","Barre, VT",44.1970055,-72.5020494,"Vermont",1100465973042315264,"@MarianKeyes I was diagnosed with strep throat yesterday, and today ive been going through cycles where I'm either… https://t.co/F1vp43DnGL"
"291","whinniedahpoo","Colorado, USA",39.5500507,-105.7820674,"Colorado",1101335347827564544,"@A_Coffee_A_Day_ Yeah abnormal pain taste of blood or pus or swelling of the lymph nodes and it’s actually been awh… https://t.co/yfIZDEafCO"
"292","whiteoakfarmer","Waynesville, NC",35.4887145,-82.9887477,"North Carolina",1101302988570804224,"@MizRvnTCB Cancer took my dad last march, my wife in November and now my dog has it in her hips and Lymph nodes.. D… https://t.co/dewfdgLSqc"
"293","Whoregano","Basura",40.0380675,-76.3032962,"Pennsylvania",1102295831779012608,"I’ve noticed a slight lump where my lymph nodes are maybe this it finally it"
"294","WieldedFate","North Ogden, UT ",41.3071645,-111.9602196,"Utah",1101661749319614464,"Silence of the lymph nodes
#BodyPartFilms"
"295","wiredmarketer","Hyannis, MA, USA",41.6524911,-70.2881124,"Massachusetts",1101962262250770432,"@c_barone @morethanmySLE So happy to hear u r ok.  Not fun. My brother has kidney cancer but unlike u found out whe… https://t.co/eAcFfx62Vo"
"296","wright__mikayla","Robinson, IL",39.0053201,-87.7391935,"Illinois",1100604737010000000,"Going to bed tonight with some Benadryl in hopes that this earache, itchy throat, and swollen lymph nodes will go away <U+0001F64F>"
"297","WrongEndotr","Kansas, USA",39.011902,-98.4842465,"Kansas",1100292869481480192,"my lymph nodes or anything. she was one, sometimes the might of Toz."
"298","wsu_cvmgsa","Pullman, WA",46.7297771,-117.1817377,"Washington",1100468304047534080,"Immune cell populations residing in mesenteric adipose depots and mesenteric lymph nodes of lean dairy cows.… https://t.co/5N9XHcBzq9"
"299","x3_ElLe","Georgia ",32.1656221,-82.9000751,"Georgia",1101250010329563136,"my lymph nodes are swollen I feel like a chipmunk lol fuck youuu pollen"
"300","xrcheymayne","no",36.670501,-95.936232,"Oklahoma",1102183062270431232,"all my lymph bodes are swollen my throat is killing me uGH"
"301","yydelane","atx/ cstat",30.627977,-96.3344068,"Texas",1101913041589936128,"I need piercing advice. My cartilage is bad infected and it’s causing one of my lymph nodes to swell and it’s rlly… https://t.co/fIzGIsuuvw"
